{
  "schema_version": 1,
  "environment": "production",
  "snapshot_id": "synthetic-validator-probe",
  "target": {
    "commit": "synthetic-validator-probe",
    "contracts_version": "synthetic-validator-probe",
    "image_digests": [],
    "migration_ids": []
  },
  "durations_seconds": {
    "export": 0,
    "transform": 0,
    "import": 0,
    "reconciliation": 0,
    "smoke": 0
  },
  "domains": [
    {
      "name": "Synthetic",
      "counts": {
        "source_rows": 0,
        "target_rows": 0,
        "delta": 0
      },
      "checksums": {
        "source": "synthetic",
        "target": "synthetic",
        "matched": true
      },
      "orphans": 0,
      "duplicates": 0,
      "rejects": {
        "fixed": 0,
        "accepted": 0,
        "rejected": 0,
        "blocking": 0
      },
      "status": "passed",
      "evidence": []
    }
  ],
  "decision": "go"
}
