{
  "schema_version": 1,
  "environment": "template",
  "snapshot_id": "not-run",
  "target": {
    "commit": "not-run",
    "contracts_version": "not-run",
    "image_digests": [],
    "migration_ids": []
  },
  "durations_seconds": {
    "export": 0,
    "transform": 0,
    "import": 0,
    "reconciliation": 0,
    "smoke": 0
  },
  "domains": [
    {
      "name": "Identity",
      "counts": { "source_rows": 0, "target_rows": 0, "delta": 0 },
      "checksums": { "source": "", "target": "", "matched": false },
      "orphans": 0,
      "duplicates": 0,
      "rejects": { "fixed": 0, "accepted": 0, "rejected": 0, "blocking": 1 },
      "status": "blocking",
      "evidence": []
    },
    {
      "name": "Workspace/Authz",
      "counts": { "source_rows": 0, "target_rows": 0, "delta": 0 },
      "checksums": { "source": "", "target": "", "matched": false },
      "orphans": 0,
      "duplicates": 0,
      "rejects": { "fixed": 0, "accepted": 0, "rejected": 0, "blocking": 1 },
      "status": "blocking",
      "evidence": []
    },
    {
      "name": "Drive",
      "counts": { "source_rows": 0, "target_rows": 0, "delta": 0 },
      "checksums": { "source": "", "target": "", "matched": false },
      "orphans": 0,
      "duplicates": 0,
      "rejects": { "fixed": 0, "accepted": 0, "rejected": 0, "blocking": 1 },
      "status": "blocking",
      "evidence": []
    },
    {
      "name": "Billing/Usage",
      "counts": { "source_rows": 0, "target_rows": 0, "delta": 0 },
      "checksums": { "source": "", "target": "", "matched": false },
      "orphans": 0,
      "duplicates": 0,
      "rejects": { "fixed": 0, "accepted": 0, "rejected": 0, "blocking": 1 },
      "status": "blocking",
      "evidence": []
    },
    {
      "name": "Audit/Privacy",
      "counts": { "source_rows": 0, "target_rows": 0, "delta": 0 },
      "checksums": { "source": "", "target": "", "matched": false },
      "orphans": 0,
      "duplicates": 0,
      "rejects": { "fixed": 0, "accepted": 0, "rejected": 0, "blocking": 1 },
      "status": "blocking",
      "evidence": []
    },
    {
      "name": "Developer Platform",
      "counts": { "source_rows": 0, "target_rows": 0, "delta": 0 },
      "checksums": { "source": "", "target": "", "matched": false },
      "orphans": 0,
      "duplicates": 0,
      "rejects": { "fixed": 0, "accepted": 0, "rejected": 0, "blocking": 1 },
      "status": "blocking",
      "evidence": []
    }
  ],
  "decision": "no-go"
}
